"school_id","school_name","school_city_n","school_state_n","school_district_n","nominator_reason_n"
"16","Avanti High School","Olympia","Washington","Olympia School District","Avanti High School stands out because it is actively redefining what school can look like: centered on equity, grounded in culturally responsive practices, and driven by mastery as a pathway to deeper understanding and student ownership. As a Washington MBLC Cohort 1 school, Avanti is not simply adjusting practices, it is reimagining the fundamental purpose and structure of schooling to ensure that every student experiences belonging, agency, and meaningful learning. Avanti’s commitment to deepening its schoolwide equity stance is evident in how it designs learning environments where students’ identities, experiences, and cultural backgrounds are recognized as assets. Their focus on improving schoolwide systems shows a deliberate effort to build structures that are both flexible and supportive, especially important in an alternative school context. By shifting from traditional time-based models to mastery-based pathways, Avanti helps students to progress through learning in ways that honor their pace, strengths, and aspirations."
"37","Citizens of the World Hollywood","Los Angeles","California",NA,"Citizens of the World Charter Schools Los Angeles (CWC LA) is a network of charter schools. The mission of CWC LA is to create an intimate network of high-achieving, community-based public schools for a diverse community of students, developing their abilities, confidence, and sense of responsibility for themselves and their community as true citizens of the world. 

COTW is an active member of Diverse Charter Schools Coalition."
"61","e3 Civic High","San Diego","California","e3 Civic High","e3 Civic High focuses on personalized, real-world learning anchored in its mission to Engage. Educate. Empower.  Students participate in design-thinking and project-based learning, with internships and civic engagement embedded into their high school experience. The school’s setting — in the downtown San Diego Central Library — provides access to advanced research resources and collaborative spaces, making school more dynamic than traditional classrooms. Graduation preparation is built-in: all scholars have college, workforce & life targets, use technology tools (e.g., MacBooks and fabrication labs), and engage in internships tied to their interests and goals."
"94","Highline Big Picture","Burien","Washington","Highline Public Schools","Highline Big Picture is deeply committed to reimagining learning through an equity-driven, student-centered lens. Its mastery-based learning model and culturally responsive sustaining education practices reinforce this commitment by ensuring students have multiple pathways to demonstrate mastery, pursue interests, and engage in authentic, real-world learning. As an alternative school, their focus on improving schoolwide systems reflects a willingness to rethink traditional structures and replace them with flexible, supportive ones that foster agency, relevance, and belonging. Their work to deepen a schoolwide equity stance shows a clear dedication to creating a community where every student’s identity, lived experience, and cultural background are recognized as fundamental to their learning journey."
"111","Latitude High School","Oakland","California",NA,"Students visit over 10 workplaces per year to explore career interests; collaborate with working professionals on Real World Projects; complete internships and student designed businesses; develop portfolios to match with local clients in the arts, multimedia, technology, etc. "
"142","North Edgecombe High School","Tarboro","North Carolina","Edgecombe County Public Schools","The North Phillips School of Innovation (NPSI) draws students and staff from Phillips Middle School and North Edgecombe High School. At NPSI, the work of learning and innovating is rich and busy. Students use the use the design process to study math, English, and science, all while working to understand themselves and their community. The learning is a highly structured experience, but one full of choices."
"172","Rooted School New Orleans","New Orleans","Louisiana","Rooted School New Orleans","Rooted School New Orleans (RSNO) exists to provide students with personal pathways to financial freedom. RSNO does not seek to tell students how they will achieve financial freedom, but rather equips them with the skills options to get there. RSNO teaches students how to learn in an ever-changing world, develop their skills in the most in-demand job sectors and create transformational technology. RSNO does this by providing students to earn an associates degree in high school, as well as a number of industry-recognized credentials that are connected to high-growth, family-sustaining jobs. "
"178","Science and Math Institute","Tacoma","Washington","Tacoma Public Schools","SAMI embodies exactly the kind of innovative, student‑centered learning environments that the Canopy Project seeks to highlight. SAMI’s fully integrated, place‑based STEM model—rooted in 702 acres of old‑growth forest, waterfront access in Point Defiance Park, and in partnership with the Point Defiance Zoo & Aquarium and Parks Tacoma—transforms traditional schooling into a dynamic ecosystem of inquiry, service, and community connection. The school’s six pathways (marine science; marine technology & robotics; computer science; veterinary science & animal life; outdoor education; conservation science) ensure that every student engages in rigorous content, hands‑on learning, and a meaningful internship that connects to post‑high readiness. SAMI’s commitment to equity, full inclusion of all learners, student leadership, and mentor‑group continuity exemplifies an environment built for all students, especially those historically under‑served. Their interdisciplinary miniterm service projects, authentic community partnerships, and pathways of real‑world relevance reflect Canopy’s emphasis on reimagined, empowering learning environments that are responsive to students’ strengths, aspirations, and communities. Nomination of SAMI would spotlight a school that is not only preparing graduates for college and career, but also cultivating curiosity, collaboration, empathy, and agency in learners ready to thrive in a complex world."
"180","SEEQS: the School for Examining Essential Questions of Sustainability","Honolulu","Hawaii",NA,"SEEQS (the School for Examining Essential Questions of Sustainability) is an innovative public charter school in Honolulu, Hawai’i, that emphasizes relevance and agency grounded in environmental and social engagement. Through their Essential Questions of Sustainability (EQS) model, students engage in real-world learning experiences, applying their knowledge to examine complex sustainability issues that impact their daily lives. SEEQS courses are designed around essential questions without simple answers (e.g., how can tourism honor and sustain Hawaii’s land, people, and culture?) and kick off with EQS Camp, a time where students build background knowledge through field studies, expert interviews, and experiences with community partners. No other classes are held during this time, allowing learners to truly immerse themselves in the essential question that interests them most. Over the course of the semester, students continue to investigate the essential question through student-driven projects, which vary from class to class and are shaped by a shared vision between students and teachers. These interdisciplinary projects are highly rigorous, integrating core subjects like English, math, science, social studies, and the arts. They require students to use a range of thinking skills to make meaning of complex ideas. At the end of the semester, students showcase their learning through public project exhibitions that are open to the community. Both essential question courses and exhibitions draw upon expertise from beyond the walls of the physical school building, embracing relevant learning and fostering student agency."
"190","The Social Justice School","Washington","District of Columbia","The Social Justice School","The Social Justice School is a 5th - 8th grade school in Washington, D.C.. Their mission is to catalyze an integrated community of middle-school learners to be scholar-activists who are designers of a more just world. In order to design a more just world, students require an education that embraces and lives out a set of core beliefs about what it means to be human. Their academic model is rooted in social justice, built around culturally-responsive learning, active learning through expeditionary learning, steady community through Crew, and empowerment through design thinking projects.  On recently released 2023-24 PARCC results, SJS shows consistent and significant academic growth, particularly for Black students, Latino/a students, students with disabilities,and multilingual students. SJS scholars are 12% more likely to experience economic hardship than the average D.C. student,yet are equal or surpass their D.C. peers in ELA and Math. "
"191","Solar Preparatory School for Girls","Dallas","Texas","Dallas ISD","Solar Preparatory School for Girls at James B. Bonham is a Dallas ISD school of choice which opened in August 2016 to serve 199 scholars in kindergarten through second grade. Solar Girls serves Prek4 through eighth grade. The school focus is single-gender education for girls from diverse socioeconomic backgrounds and integrated, performance-based STEAM (Science, Technology, Engineering, Arts, and Math) instruction combined with social emotional learning. The school is designed around a STEAM instructional model designed to help foster every child’s love of science, technology, engineering, math and the arts.  The school has had leading results in the Dallas Independent School District since inception and has emerged as one of the strongest post-COVID recovery stories in the state of Texas."
"210","UCLA Community School","Los Angeles","California","Los Angeles Unified School District","UCLA Community School is an innovative K-12 learning environment that prepares all students for college, work, and civic participation. The instructional program is community-based, learner-centered, and university-assisted. Building on the strengths of the local neighborhood, the school is bilingual, bi-literate, and multi-cultural. Parents and community members are integral members of the school and their funds of knowledge help shape the instructional program. UCLA-CS personalizes learning for each student to ensure and document academic, social, and emotional growth over a student’s school career. Students have Personalized Learning Plans that build on their interests and needs, supporting them as active learners in a variety of experiences including projects, rigorous coursework, council, internships, peer tutoring, seminars, experiments, and so on"
"213","Valley New School","Appleton","Wisconsin","Appleton Area School District","Using AI in innovative ways an giving kids unprecenedented access to tech, they are a PBL lab school, low student to teacher ratio"
"215","Valor Flagship Academy","Nashville","Tennessee","Valor Collegiate Academies","The student and educator experience at Valor is anchored in the Compass model, which fosters holistic and adaptive development through a focus on community and relationships as well as individual work to understand oneself. As learners engage in the Compass Phase System and Circle, the community comes together to support themselves and each other, supporting development and growth across the Compass Habits and Disciplines. As a result, students and faculty report a strong sense of connection and community. The Compass approach is combined with a rigorous academic model, which has led to Valor students rank in the top 5% of achievement scores and top 1% of growth scores in the state of Tennessee."
"215","Valor Flagship Academy","Nashville","Tennessee","Valor Collegiate Academies","The student and educator experience at Valor is anchored in the Compass model, which fosters holistic and adaptive development through a focus on community and relationships as well as individual work to understand oneself. As learners engage in the Compass Phase System and Circle, the community comes together to support themselves and each other, supporting development and growth across the Compass Habits and Disciplines. As a result, students and faculty report a strong sense of connection and community. The Compass approach is combined with a rigorous academic model, which has led to Valor students rank in the top 5% of achievement scores and top 1% of growth scores in the state of Tennessee."
"216","Valor Voyager Academy","Nashville","Tennessee","Valor Collegiate","The student and educator experience at Valor is anchored in a human development framework called Compass. It helps young people and adults strengthen the habits, mindsets, and values they need to navigate life with purpose. Rather than treating academics and personal growth as separate, Compass integrates them. Students build intellectual curiosity and academic skills while also developing clarity about their values, empathy in relationships, and sense of how their individual gifts can serve their community.  "
"237","ACE Leadership High School","Albuquerque","New Mexico","Albuquerque","ACE partners with leaders in New Mexico’s architecture, construction, and engineering industries to set students up to get ahead in a changing world. They offer both day and evening programs to ensure that every student — whether returning to school after an absence, raising a family, or holding down a job — has the individualized support they need to succeed."
"281","Health Leadership High School","Albuquerque","New Mexico",NA,"Prepares students for careers in healthcare through experiential learning. Also broadens students' understanding of social determinants of health. This was the first high school in NM to have a class of students complete Community Health Worker dual credit certificates with their partner, Central New Mexico Community College."
"291","International High School at Langley Park","Bladensburg","Maryland","Prince George's County Public Schools","IHSLP is a competency-based learning model designed specifically for multilingual learners with a strength in school culture and social-emotional learning, advisory in particular. The instructional model serves multilingual learners with mastery projects, peer collaboration, common instructional strategies across all teachers/grades/subject areas, and language skills embedded in all courses."
"323","Northeast Academy for Aerospace and Advanced Technologies","Elizabeth City","North Carolina",NA,"Numerous college, university, and business partners to offer learning opportunities and connections for students. Pathways to both college and high paying, high demand careers close to home in the fields of Aviation, Comp Science, Health Sciences, and Advanced manufacturing."
"323","Northeast Academy for Aerospace and Advanced Technologies","Elizabeth","North Carolina",NA,"NEAAAT is an innovative regional public school that equips students with STEM-focused skills through authentic, project-based learning and pathway options in aviation science, computer science, and health science, with opportunities to earn certifications and take honors-level courses. As students progress, they may enroll in college courses through Elizabeth City State University or the College of the Albemarle, and they further develop career readiness through internships and community service."
"360","The Center for Advanced Research and Technology (CART)","Clovis","California",NA,"CART lets juniors and seniors dive into real-world, project-based learning through more than a dozen specialized labs — from biotechnology to digital media to engineering — giving them hands-on, career-focused experience long before college. Plus, with its industry partnerships and the chance to earn college-prep credits and build a strong portfolio, CART turns high school into a launchpad for meaningful, future-ready careers."
"386","""""School of Industrial Design, Engineering and Art""""","Tacoma","Washington",NA,"The school's curriculum is designed to integrate the arts, science, and math, providing students with a unique and interdisciplinary educational experience. The school's community is made up of high school students, non-profits, professional organizations, and for-profit businesses of all sizes. iDEA's goal is to form a collaborative learning environment where partners can work alongside students in design-and-build studios, forming public to private partnerships and giving both students and teachers access to professional opportunities. The school's curriculum aligns with common core standards in math, science, English, and social studies and follows the gold-standard project-based learning framework outlined by the Buck Institute. iDEA students learn through projects, with teachers acting more like guides for students, posing challenging questions and working to embed learning targets within the context of student-driven, real-world projects. The school's emphasis on collaboration, real-world projects, and professional opportunities makes it a unique and student-centered learning environment."
"386","""""School of Industrial Design, Engineering and Art""""","Tacoma","Washington","Tacoma Public Schools","IDEA's focus areas include industrial design, engineering, and art, with opportunities to gain career-specific expertise in areas like robotics, game design, green architecture, animation, and music production. Instruction is organized around project-based learning where students create tangible and sometimes functional products. IDEA’s teachers function more as guides or coaches and assessment places more emphasis on the learning process, prototyping, and growth over time than on grades."
"408","Alta Vista Innovation High","San Bernardino","California",NA,"Alta Vista Innovation High School offers a highly personalized model where flexible scheduling and one-on-one instruction ensure each student’s journey is tailored. It integrates strong workforce readiness with academics—teaching real-world skills like financial literacy, entrepreneurship, and connecting students via community and industry partnerships. From day one through graduation students are supported to set clear post-secondary goals—whether college, career or training—and built up with the tools, mentorship and experiences to meet them."
"415","Yu Ming Charter School","Oakland","California","Yu Ming","Yu Ming provides full Mandarin immersion for every child. Yu Ming’s approach rests on four pillars: academic excellence, Mandarin immersion, whole-child education, and a deliberately diverse, inclusive community.
Yu Ming operates four campuses and consistently ranks among the top 1% of elementary and middle schools in California for Black and Latino students, English learners, students with disabilities, and economically disadvantaged students."
"417","Grant Beacon Middle School","Denver","Colorado","Denver Public Schools","The school is tapping into students’ passions and showing what opportunities are possible through its extended enrichment program for all students such a pilot program, while also making sure our most marginalized students have what they need to grow academically and engage with the community in the most authentic ways."
"418","Kepner Beacon Middle School","Denver","Colorado","Denver Public Schools","The school is tapping into students’ passions and showing what opportunities are possible through its extended enrichment program for all students such a pilot program, while also making sure our most marginalized students have what they need to grow academically and engage with the community in the most authentic ways."
"422","Inspired Teaching Demonstration Public Charter School","Washington, DC","District of Columbia",NA,"At the Inspired Teaching Demonstration Public Charter School, a professional learning community of master teachers and teacher residents ensures that a diverse group of students achieve their potential as accomplished learners, thoughtful citizens, and imaginative and inquisitive problem solvers through a demanding, inquiry-based curriculum. 

The standards-based curriculum and student goals are centered on the 4 I’s: 
Intellect
Inquiry
Imagination
Integrity

Inspired Teaching is an active member of Diverse Charter Schools Coalition."
"433","The Urban Assembly School for Green Careers","New York City","New York",NA,"The Urban Assembly School for Green Careers recognizes that overcoming our planet's environmental challenges is the biggest task facing the world today. We understand that as our economy becomes more green, many of the future's most promising careers will focus on solving the challenges of environmental injustice, and in ensuring equitable access to quality living and resources for all citizens. Our students will only be able to activate this mission if they are equipped with collaborative problem-solving and reasoning skills, empathy and awareness of how to interrupt injustice, and the knowledge of green industries and environmental issues. Therefore, we are committed to being a learning community dedicated to personal and community empowerment, college and career-readiness, and equity and access to and for our students, families and staff."
"433","The Urban Assembly School for Green Careers","New York City","New York",NA,"Students at UA School for Green Careers act, write, and build to confront the challenges to human rights created by climate change. Through Cooperative Group Work, all students engage in peer-to-peer dialogue that supports critical thinking skills. Through 1:1 Conferences with Teachers, students receive personalized attention, feedback, and develop independent problem-solving skills through conferences facilitated by their teachers. And, through Peer-to-Peer Supports, students develop critical thinking and reason-giving skills."
"434","""""Urban Assembly Charter School for Computer Science (d/b/a """"""""Comp Sci High"""""""")""""","Bronx","New York","Comp Sci High","Comp Sci High is a 9-12 charter high school in the Bronx that is guided by one central question: What would it take to achieve lasting economic freedom for every single student who walks through our doors? Comp Sci High hold themselves accountable to that mission by equipping every graduate with the skills, sense of purpose, and network of support required to secure a fulfilling career and earn at least the national median income by age 25 (projected at $97,000 for the founding class of 2029). To make this possible, Comp Sci High goes beyond traditional academics. Students engage in: work-based learning education, real-world work experience, and sustained relationships and support"
"443","Rooted School Indianapolis","Indianapolis","Indiana","Rooted School Indianapolis","Rooted School Indy is a free public charter school serving Grades 7-12, located at Eastern Star Church in partnership with The ROCK Initiative. This partnership is designed to expand high-quality school options located on or in proximity to the Eastern Star Church Campus. Rooted School Indianapolis exists to provide students personal pathways to financial freedom. We teach our students how to learn in an ever-changing world, develop their skills in the most in-demand job sectors and create technology that is transformational."
"456","High School for the Recording Arts","St. Paul","Minnesota",NA,"HSRA empowers students to take ownership of their learning, blends academics with meaningful real-life experience, emphasizes individual growth, and supports post-secondary readiness—all of which make the learning environment more engaging, effective and empowering."
"456","High School for the Recording Arts","St. Paul","Minnesota",NA,"HSRA is a long-standing career connected learning school with a focus on an industry that has deep roots in the Twin Cities. The schools is """"dedicated to providing all young people a chance to realize their full potential, despite any previous setbacks."""""
"468","Da Vinci Communications","El Segundo","California",NA,"DaVinci Schools take a completely student-centered approach across all of their models, both on-campus and hybrid. Learning is purposeful, experiential, rigorous, and engaging. They have developed a strong community within each school, supported by deep relationships among students and teachers alike. They have a tremendous learning mentality -- they are ceaselessly seeking to improve, when already they provide a learning and developmental experience to kids that should be a model for the entire nation."
