"school_id","school_name","school_city_n","school_state_n","school_district_n","nominator_reason_n"
"1598","Jefferson County Open School","Lakewood","Colorado","Jefferson County School District R-1","Jeffco Open has been a pillar of innovation the Denver Metro area for decades. Their pedagogy is progressive grounded in student agency and projects. The path to graduation is through a series of independent projects demonstrating learning in key competencies. They foster agency also through student planned trips nationally and internationally."
"1599","The Stead School","Reunion","Colorado",NA,"The STEAD School is a Science, Technology, Environmental, Agricultural and systems Design charter high school focused on solving global food, health, energy, and environmental issues.

STEAD engages students in real life, hands-on learning, utilizing a Career and Technical Education (CTE) Agricultural Pathways curriculum in plant, animal, food, and environmental sciences. STEAD uses a Project Based Learning (PBL) approach integrating CTE curriculum and aligning guiding questions into a PBL framework where students explore these questions and utilize their findings as the foundation for projects. In addition to the scientific pathways of study, lessons in math, art, music, foreign language, English language arts, and history align with projects and engage students in deeply focused studies, Socratic seminar and community presentations."
"1600","Gran Via Education","Denver","Colorado","ER BOCES","Gran Via is deeply rooted in community responsiveness, listening to the needs of the students and families they serve and building their program for them. Gran Via has returned learning to nature, they meet each day in Westland Park as a forest school/nature school program. Due to the intentionally small nature of the school, Gran Via knows all of their students well, sees them for who they are, and responds to their unique needs in real time. They are relationally focused, while creating a rich learning environment for every child."
"1601","Boston Teachers Union","Boston","Massachusetts","Boston Public Schools","In 2005, the Boston Teachers Union and the Boston School Committee negotiated an agreement under which the Boston Teachers Union would open a new, teacher-run school to showcase their commitment to educating Boston’s children. Both the Union and the Boston Public Schools were excited about this unprecedented partnership, and worked hard to make it a reality. A committee of educators and union officers met regularly during the 2008-09 school year to plan and design the school. The first lead teachers were hired in February 2009, a partnership with Simmons College was formalized later that spring, and the Boston Teachers Union School opened its doors in September 2009, with 150 students in grades K1-2 and grade 6. By September 2011, we were a full K-8 school with approximately 340 students.

We are a shared leadership school. We do not have a principal, but instead direct the operation and development of the school through our committee structure, and our weekly faculty meetings. Our decision making is intentional and many decisions are made by consensus. Two lead teachers with a reduced teaching load perform many of the daily administrative tasks. We are part of a national network of teacher-powered schools. "
"1602","John J. Duggan Academy","Springfield","Massachusetts","Springfield Empowerment Zone Partnership","Duggan Academy is an teacher-powered Expeditionary Learning community dedicated to upholding high academic expectations through authentic learning experiences. Its students, grades 6-12, attain academic success and demonstrate exemplary character.

Duggan Middle School provides two hours per week of embedded enrichment with community partners as well as robust varsity and junior varsity athletic programs.

Duggan High School offers a variety of internships, AP courses, and dual enrollment classes in partnership with Western New England University, Springfield Technical Community College, Springfield College, and Westfield State; it graduated its first class in 2019."
"1603","Washtenaw International High School","Ypsilanti","Michigan","Washtenaw Educations Options Consortium","Washtenaw International High School is a public consortium, Teacher-Powered, International Baccalaureate (IB) High School for academically focused students in participating school districts in Washtenaw County, Wayne County, Oakland County, and Livingston County. WIHI opened its doors in the fall of 2011 with approximately 100 students and now serves 490 students in grades 9 through 12.

WIHI provides a rigorous, student-centered, inquiry-based instructional and curricular program with an emphasis on international mindedness, interdisciplinary knowledge, leadership development, and critical thinking.

Washtenaw International High School ranks #1 in Washtenaw County for ACT and College Readiness, and #2 in the state of Michigan. WIHI’s exceptional staff have a wealth of international experience, academic expertise, and passion for teaching and learning.

In addition to earning a high school diploma, all students at WIHI work towards earning an International Baccalaureate Diploma, regarded as the most rigorous and reputable high school curriculum in the world."
"1604","Elizabeth City-Pasquotank Public Schools Micro School","Elizabeth City","North Carolina","Elizabeth City-Pasquotank Public Schools","Elizabeth City’s micro school is reimagining what school can be inside a traditional public system. Students work in mixed grade communities and spend their days designing a real Airbnb concept, merging science, social studies, and English standards into a meaningful project with authentic audience and purpose. Young people lead the marketing plan, develop the concept, and manage the full creative process, gaining skills in research, writing, collaboration, and design.

The learning environment extends into the community. Students take gym at a local fitness center, study photography with a local photographer, and create art at a local performing arts studio. This approach opens up the entire region as a learning campus and shows what is possible when schools partner deeply with local talent.

Perhaps most importantly, the school is proving that bold innovation can flourish in a traditional district. With a superintendent who completed Transcend’s rural leadership cohort and is committed to big, human centered change, the team has navigated bureaucratic structures to create experiences that are engaging, effective, and empowering for all students."
"1605","Notre Dame de Sion High School for Girls","Kansas City","Missouri",NA,"As a college-prep school, that's by far not the only thing they prepare these young ladies for. Sion structures the school year by incorporating ample opportunities for the ladies to learn about themselves through interdisciplinary deep dives, cultural immersion events, community service outreach projects and travel abroad experiences. The first week of school is dedicated to a theme each year and allows the students to lead non-academic sessions, grow in leadership skills development, and learn about the school's rich history. The school is truly dedicated to developing the whole student by bringing in the community to lead workshops ranging from self-defense to managing a budget that will support the growth of the ladies for years to come. "
"1607","High Marq Environmental Charter School","Montello","Wisconsin","Montello School District","For 15 years and counting, High Marq has provided a unique educational opportunity for students in rural Marquette County, Wisconsin. With a focus on environmental learning and community service, High Marq staff prepare students for careers and post-secondary options with a flexibility that meets every student's unique needs."
"1608","Kind Academy Coral Springs","Coral Springs","Florida",NA,"Kind Academy was built in response to the school offerings in the area. They have created an environment where students and families not traditionally exposed to Montessori are thriving while being culturally relevant and embedding SEL into daily practices. KIND Academy offers families hybrid offerings for flexibility and embraces their location in Florida to have immersive learning experiences with nature and aquatic wildlife. Students who were not thriving in prior environments, find the personalized learning and family like structure supportive. "
"1609","Kalon Prep Academy","Alexandria","Minnesota",NA,"Kalon Prep Academy, located in rural Minnesota, reimagines high school through a strengths-based approach that helps students discover who they are and where they want to go. Using the REACH model—focused on relationships, education, accountability, character, and hard work—the school supports students academically, socially, and emotionally as they prepare for life after graduation. Small class sizes and personalized coaching allow students to build on their strengths, set meaningful goals, and develop essential life skills. With opportunities to explore careers, visit colleges, and engage in real-world learning, Kalon Prep creates a supportive, future-focused environment where students can grow into confident, capable young adults ready for their next steps."
"1611","E.C.H.O. Charter School (Every Child Has Opportunities)","Echo","Minnesota",NA,"E.C.H.O. Charter School, located in rural Minnesota, reimagines learning by blending a close-knit, relationship-driven environment with strong career and technical education opportunities that prepare students for life beyond high school. Its small size and low student-to-teacher ratios ensure that every learner is known, supported, and able to receive individualized attention. The school’s emphasis on hands-on, project-based learning allows students to explore practical skills and real-world career pathways while still in high school. Rooted in its rural community yet forward-looking in its design, E.C.H.O. creates a learning experience that connects academic growth with meaningful, future-ready opportunities for every student."
"1612","BlueSky Online","Statewide","Minnesota","BlueSky Online","BlueSky Online stands out for its deeply personalized, whole-child model that surrounds every student with a dedicated team—including an advisor, counselor, social worker, and teachers—who work collaboratively to guide both academic progress and personal growth. Learning is flexible and responsive, with options for structured, teacher-led courses or self-paced pathways that honor each student’s needs and circumstances. BlueSky intentionally develops and assesses learning in broader, more meaningful ways, emphasizing skills like responsible decision-making, self-management, and real-world readiness. By pairing individualized instruction with comprehensive social-emotional support, the school reimagines online education as a relationship-centered, empowering experience that helps students thrive as learners and as whole people."
"1617","Warwick Community School","Warwick","Massachusetts","Warwick Community District","The Warwick School District is a newly formed district in Franklin County, Massachusetts. After the regional school district closed down the town’s only elementary school in 2020, community members came together to identify innovative ways to keep their children in the community and decided to launch their own school district. The school is a K-8 STEAM/nature-based, project-based learning school that measures student success through community exhibitions of learning and portfolios as well as through standard measures of learning, such as annual growth in ELA in Math. Through a multi-age classroom model, students are exposed to different learners and benefit from deep personalization. The team aims to provide a blueprint for other rural communities looking to collaborate with surrounding towns on innovative ways to build out their own local districts."
"1619","Kindle Education","Jersey City","New Jersey","Kindle Education Public Charter School","Kindle Education is a racially and socioeconomically diverse 6th–12th grade public charter school in Jersey City that empowers students through a student-driven, project-based, and inquiry-oriented model. Our holistic approach combines rigorous academics with real-world application, personalized support, and a deep focus on purpose, individuality, and community."
"1620","The Village School","Arlington","Virginia",NA,"This small school is centered around self-directed learning. Students learn through projects and play, demonstrating growth through flexible proficiency rather than worksheets and assessments. In their own words, at TVS they """"focus first on nurturing a sense of safety in our learners– security in who they are, what they are capable of, where they belong, and why they matter."""""
"1621","New Hampshire Career Academy",NA,"New Hampshire","The New Hampshire Charter School Foundation","NHCA exists at the intersection of education and workforce development, creating direct pathways from the classroom to the state’s most in-demand careers. Along the way, students gain hands-on experience, mentorship, and professional confidence that prepare them to thrive in whatever comes next, continuing their education, entering the workforce, or both. Through a collaboration with the Community College System of New Hampshire (CCSNH) and partnerships with local employers, students learn on college campuses, earn two degrees, and build the skills that open doors to higher education and meaningful careers.
 "
"1622","Denver Green School Northfield","Denver","Colorado","Denver Public Schools","As part of the Luminary Learning Network's innovation zone, this school  uses practices like not having a principal, using non-licensed teachers for electives, giving teachers more freedoms for when they take personal days, more planning minutes, and an increased role for students and educators in school decision making. The school model emphasizes real world experiences through excursions and an emphasis on sustainability."
"1623","Mark Twain Dual Language Academy","San Antonio","Texas","San Antonio Independent School District","This school offers an education design rooted in evidence-based bilingual education practice. The student experience is coherent from elementary through middle school and educators use collaborative planning time for intentional aligninment and scaffolding  esulting in consistent academic growth. The staff advocate for and explore more assessments that better represent their student population's strengths and abilities, and are active in building community through mentorship and family engagement. "
"1624","Brooklyn Emerging Leaders Academy Charter School","New York City","New York","New York City Public Schools","As a single sex all-female charter high school with IB for all and strong leadership development programming and mentoring focused on empowering young women to be successful in college and career, BELA is reimagining how the structure and experiences in school can set students up for success."
"1625","Phillips Middle School","Tarboro","North Carolina","Edgecombe County Public Schools","The North Phillips School of Innovation (NPSI) draws students and staff from Phillips Middle School and North Edgecombe High School. At NPSI, the work of learning and innovating is rich and busy. Students use the use the design process to study math, English, and science, all while working to understand themselves and their community. The learning is a highly structured experience, but one full of choices."
"1626","Kujawa Elementary","Houston","Texas","Aldine ISD","Kujawa implements an innovative model, the Whole Child Model, which integrates multiple tiers of support throughout the school day to build a safe and supportive school climate as well as the intrapersonal and interpersonal skills young children need to regulate their emotions, manage stress, and handle conflicts productively."
"1627","Forte Preparatory Academy Middle School","Elmhurst","New York","N/A, but the comparable district is Queens CSD 24","Forte Preparatory Academy opened in fall 2017 in response to a critical need: at the time, 77% of local students in East Elmhurst and Corona were not prepared for college. Initially authorized for grades 5-8, Forte expanded in 2023 to include a high school program and is now chartered to serve grades 5-12.

The school’s mission is to prepare all students to excel academically and to use their leadership and voice to positively impact the world, and they are demonstrating strong results in this mission. Forte’s college preparatory curriculum is designed to close achievement gaps, especially for low-income and English Language Learner students. Students benefit from an environment that emphasizes character development through core values: service, teamwork, resilience, integrity, voice, and excellence.
Beyond academics, students have opportunities to participate in music and the arts at every grade level, fostering creativity and cultural pride. The high school program builds on these foundations by deepening community identity, developing leadership, accelerating college credit accumulation, and career exploration.
Forte’s commitment to high-quality instruction is evident through a strong focus on curriculum development, carefully crafted lesson plans, and ongoing professional development for teachers. The school also places a strong emphasis on partnerships with families and local organizations, ensuring that the entire community is engaged in student success.
Today, Forte Preparatory stands as a vibrant school community where students are empowered to strive for excellence and lead with integrity. Through a rigorous academic program, a robust arts curriculum, and a focus on character, students graduate prepared not only for college but for lives of purpose and leadership."
"1627","Forte Preparatory Academy Middle School","Elmhurst","New York","Forte Preparatory Academy","Forte Prep Academy's High School (FPHS) builds on the strong academic, social, and emotional foundation established in its existing middle school program. There are six key design elements including: a strong academic core, enrichment in arts and language, building student voice through service, social and emotional learning via advisory, accelerated college credit acquisition, and smart use of time and space. Using a city-centered learning approach, students learn about their local community and develop a deep understanding of the immigrant stories that make their neighborhood unique."
"1628","Legacy College Prep","Bronx","New York","N/A, but the school's comparable district is Bronx CSD 7","Legacy College Preparatory opened in 2017 with a commitment to providing rigorous instruction to prepare students to attend and complete college along with values-based character development, and supporting students to set ambitious goals to drive their preparedness for college and their pursuit of post-secondary aspirations. The school's educational model is rooted in their PRIDE values (Professionalism, Respect, Integrity, Determination, and Engagement) and their emphasis on leveraging highly-effective, mission-driven teachers who conduct frequent and purposeful data analyses to inform classroom instruction. Legacy nurtures important partnerships with families through consistent communication and by offering parent seminars on a variety of topics to empower families with the tools, knowledge, and confidence to support their children's growth and success. Through advisories, a broad variety of enrichment activities, field trips, and community service, students develop as well-rounded, community-minded leaders, in addition to building critical academic skills. "
"1629","Greater Dayton School","Dayton","Ohio",NA,"Instead of defining success by test scores, the school starts with a destination: what kind of adults its students will be at age 27 (healthy, financially independent, living with character, and successful by their own definition). The curriculum and supports are reverse-engineered from those goals. It’s Ohio’s first private non-religious school solely dedicated to students from low-income backgrounds, with admissions guided by income criteria and neighborhood school performance. Core values include putting kids’ needs and success ahead of adults’ convenience, dreaming big, shared ownership of outcomes, and doing the right thing. Students benefit from low student-teacher ratios, individualized plans, extended days, and extra help as needed. The 11-acre campus was designed with flexible learning spaces, wellness facilities, playgrounds, and community areas to make school inviting and nurturing."
"1631","Math Engineering and Science Academy Charter School (MESA Bushwick)","Brooklyn","New York",NA,"Among the strongest academic results in NYS, great partnerships with employers across the city and alumni support to ensure success in college AND career. Launched 2nd school already."
"1631","Math Engineering and Science Academy Charter School (MESA Bushwick)","New York City","New York","NYC Public Schools","MESA is rethinking and innovating on what the high school student experience can look like, with a strong focus on experiential learning, and career connected learning where students are connected with internships, workplace tours, and residential college programs to support their understanding of viable career paths. MESA is also building innovative programming to support their alumni in college and career pathways after graduation."
"1632","ABQ Charter Academy","Albuquerque","New Mexico",NA,"The school is excited to serve all students between the ages of 16 and 21 who have been disenfranchised from educational opportunity, including refugee students, single parents, students with disabilities, gifted learners, English language learners, or anyone looking for a customized approach to learning. This includes crafting flexible schedules for those students who cannot attend school regularly due to child care or employment, and partnering with UNM and CNM to offer college and career training which is integrated into students’ high school curriculum. They developed partnerships with the following agencies to offer paid internships to our scholars that lead directly to professional careers after school with NM Workforce Solutions, Albuquerque Public Schools Internship Program, Big Brothers, Big Sisters of New Mexico, and the Career Enrichment Center."
"1633","Bingham Academy","Blackfoot","Idaho",NA,"Bingham Academy is the first Science, Technology, Engineering, and Mathematics (STEM) certified in Idaho; offers its students in person college courses on its campus in Blackfoot; offers two Career Technical Education (CTE) pathways: pre-engineering and Certified Medical Assisting; offers one CTE cluster in computer science and programming."
"1634","Meridian Medical Arts Charter High School","Meridian","Idaho",NA,"Meridian Medical Arts Charter High School is a free, four-year public high school with an emphasis on the health sciences that was recently rated as the #1 Charter School in the State of Idaho. Students can expect site-based learning opportunities, real world experience, and college level academic courses. MMACHS is also one of only a handful of Career Technical Centers in Idaho. "
"1635","Academy Of Collaborative Education","Monroe","Louisiana",NA,"Integrated academic and therapeutic programming for students with autism spectrum disorders."
"1636","CAST Med High School","San Antonio","Texas","CAST Schools","CAST Med High School is a dual-language, medically focused public school that prepares 9th–12th graders for careers in healthcare and biomedical sciences through hands-on learning, industry-recognized certifications, and early college credit opportunities. Students gain real-world experience through mentorships, job shadowing, internships, and a wide range of extracurricular and community-based learning opportunities within a supportive, future-focused community."
"1637","IYC Iovine And Young Center","Los Angeles","California","Los Angeles Unified School District","The Iovine & Young Center reshapes high-school by integrating design, technology, entrepreneurship and core academics into one interdisciplinary program. Students engage in real-world, project-based learning — collaborating with industry experts, using state-of-the-art tools and working across disciplines rather than in isolated subject silos. The structure emphasizes the next generation of thinkers: students develop strong foundations in creative problem-solving, teamwork, critical thinking and innovation, preparing them for competitive colleges and careers in a changing world."
