"school_id","school_name","school_city_n","school_state_n","school_district_n","nominator_reason_n"
"872","Innovation Heights Academy","Seattle","Washington","Highline Public Schools","As a small alternative school serving grades 9–12, Innovation Heights is uniquely positioned to reimagine learning through deep relationships, individualized support, and responsive design. Innovation Heights is laying the groundwork for systems that reflect its values: honoring students’ identities, fostering belonging, and creating pathways that meet learners where they are. Their willingness to test ideas, listen to students, and iterate is a powerful indicator of a school committed not just to change, but to meaningful transformation."
"872","Innovation Heights Academy","Burien","Washington",NA,"Innovation Heights Academy strives to be a flexible learning option for students. They are a half day program, where students can engage in experiential learning, practice habits of life balance, and accelerate their progress toward graduation.

To provide flexibility for students, Innovation Heights Academy operates on a half day model. Students come to school Monday through Thursday for either the morning (8:30-11:30am) or afternoon session (12:00-3:00pm).

Students have the opportunity to progress toward graduation faster. Students can earn up to 9 credits in a year, as compared to 6 credits in a year in a traditional model. 

Instruction at Innovation Heights Academy is two hours each day. Students engage in project-based learning through cross-curricular learning blocks. Learning focuses on developing real-world skills which will be related to students’ individual goals. 

In order to ensure that they are preparing students to be successful in life beyond high school, they allow space for students to learn about life balance and wellness. Students spend one hour a day focusing on physical, mental, and social wellness.

Fridays are required for students who are struggling with attendance, behavior, or grades each week. Weekly, students meet with their advisor to discuss their progress toward their goals and determine if they need assistance re-engaging in their work. If students are making adequate progress on their goals, students can still come on Friday for access to clubs, community partners, and other connections."
"875","Liberty High School","Dayton","Ohio","Oakmont Education","In general, Oakmont’s comprehensive academic model provides an individualized, self-paced program that is responsive to each student’s needs. Their rigorous digital curriculum aligns with state standards and offers components that allow teachers to differentiate instruction to address diverse student needs. Each campus provides a unique blend of classroom instruction and hands-on work experience that results in students earning their diploma while also earning the nationally recognized industry credentials that will help them start their career. Oakmont offers 15 different industry credentials in three separate Workforce Development Clusters, including skilled trades, community health and wellness, and business and entrepreneurship. This training focuses on providing real-world experience for in-demand jobs in essential fields. This training empowers graduates to earn a sustainable living wage in high-demand careers without college debt."
"884","H.D. Cooke Elementary","Washington DC","District of Columbia","DCPS","HD Cooke Elementary School implements an innovative model, the Whole Child Model, which integrates multiple tiers of support throughout the school day to build a safe and supportive school climate as well as the intrapersonal and interpersonal skills young children need to regulate their emotions, manage stress, and handle conflicts productively."
"885","Raisbeck Aviation High School","Tukwila","Washington",NA,"Teachers and students engage in authentic, in-depth learning experiences in the context of real-world aviation and aerospace. Learning occurs in a coherent manner through challenging inquiry and project-based curriculum. Learning takes place inside the school and out, in cooperation with community, business and higher education partners. Partnerships provide human talent, facilities, technology and other resources necessary to prepare students for the ever-changing world of work and education."
"889","Mountain Academy at Teton Valley","Victor","Idaho",NA,"TSS offers a place-based learning model that leverages project-based learning and is deeply entrenched in the local community. They also offer tranings for teachers to support their model."
"893","Aldine Young Women's Leadership Academy","Houston","Texas",NA,"This school creates a learning environment that is engaging, effective, and empowering for all students."
"894","Ermel Elementary","Houston","Texas",NA,"This school creates a learning environment that is engaging, effective, and empowering for all students."
"895","American Indian Magnet School","St. Paul","Minnesota",NA,"This school creates a learning environment that is engaging, effective, and empowering for all students."
"896","Txuj Ci HMong Lower Campus","St. Paul","Minnesota",NA,"This school creates a learning environment that is engaging, effective, and empowering for all students."
"897","Txuj Ci HMong Upper Campus","St. Paul","Minnesota",NA,"This school creates a learning environment that is engaging, effective, and empowering for all students."
"902","Harris Elementary","Houston","Texas",NA,"This school creates a learning environment that is engaging, effective, and empowering for all students."
"903","Whittier Elementary School","Mesa","Arizona",NA,"This school creates a learning environment that is engaging, effective, and empowering for all students."
"904","Southern University Lab School","Baton Rouge","Louisiana",NA,"Southern University Lab School (SULS) strives to make the most of a student’s unique gifts, while helping each child achieve academic excellence, master learning skills, develop greater imagination, and establish strong self-esteem. As a college preparatory school, their academic program challenges, supports, and inspires its students. The learning experience at SULS promotes a culture where students sharpen their skills and discipline not only to succeed at their next level of education, but also to pursue their individual talents and interests. SULS' intimate learning environment helps foster a sense closeness amongst the student body and contributes to a strong community identity."
"911","JPS-Tougaloo Early College High School","Tougaloo","Mississippi",NA,"JPS-Tougaloo Early College High School (JTECHS) is a dual enrollment program on the Tougaloo College campus that seeks to promote: excellence, community, honor, and scholarship. Students in the program complete Mississippi graduation requirements for high school while working on college coursework. Students may earn an associate's degree or up to two years of credits towards a bachelor's degree. The faculty and staff focus on teaching students the academic behaviors which prove successful in this academicaly challenging program and learning environment so they may be empowered to serve as agents of change. Upon program enrollment, each student is guided by an individualized learning plan developed to help them to experience success and graduate from high school college and career ready."
"912","Kyrene de las Manitas Innovation Academy","Tempe","Arizona",NA,"Kyrene de las Manitas Innovation Academy reimagines the traditional learning environment with innovative practices in learning environments, instructional methods and staffing. Each learning studio within the program serves up to 120 students, and is taught by a core team of educators: one Teacher Executive Designer (TED), along with certified teachers and teacher candidates. Learning studios at Kyrene de las Manitas look, sound, and feel different from a typical classroom. The studios are open and dynamic, with fewer walls and a variety of learning spaces, all equipped with state-of-the-art technology and furniture designed for flexibility and collaboration. The staffing and curriculum are designed to prepare students for colleges and careers that are changing rapidly. Through a personalized, project-based learning approach, students have a chance to explore real-world issues and meaningful topics over the course of several weeks, to build knowledge on each topic through literature, research, and hands-on practice. Students simultaneously master grade-level standards and work toward a final project that puts all of their learning to work. Teachers encourage and facilitate discussion, collaboration and healthy debate. Students learn to question themselves and their peers, to foster a growth mindset. "
"914","Atlanta Unbound","Atlanta","Georgia",NA,"The AUA will serve as a beacon of academic promise and create a community of students who are the seeds of their ancestors’ wildest dreams—authentic, engaged citizens and leaders of their community who achieve beyond expectations and fuel the advancement and glory of their people."
"919","Florida A&M University Developmental Research School","Tallahassee","Florida",NA,"FAMU DRS is a laboratory school affiliated with Florida A&M University and is committed to providing a quality education for students by promoting rigor and innovative strategies for teaching and learning. Utilizing a performance-based, continuous improvement model, FAMU DRS nurtures and guides students as they develop the critical thinking, problem-solving, technological, leadership, and collaborative skills necessary to engage and compete in the ever-changing, ever-evolving global community in which they live. """"Baby Rattlers"""" experience a safe, nurturing, and creative atmosphere where they can explore and thrive."
"987","University Middle School","Memphis","Tennessee","University Schools, An Innovative School District ","This is one of the only Project Based Learning middle schools in this region, and a STEM designated school in the state of Tennessee. They have a strong focus on cross-curricular learning, and student-led projects. This hands on, experiential learning matures students' understanding of themselves and the world. Additionally, they have found a way to be on the end of adopting AI led learning across the student and teacher population. "
"990","Rock Tree Sky","Ojai","California",NA,"Rock Tree Sky was founded by parents and professional educators to offer children an environment grounded in natural curiosity and propensity to learn rather than compliance, serving as a homeschool enrichment and support center. It was started to meet the needs of homeschooling and independent study families who wanted a child-centered home base and community learning hub with flexible part-time options. What makes it distinctive is its groundbreaking partnership with the local school district's independent study program (Summit School), which provides financial accessibility while preserving learner autonomy—a model they've shared with 15+ other programs nationally. Students have complete agency to choose daily activities from mentor-led offerings or self-initiated pursuits, with access to makerspaces, gardens, farms, and natural settings. The program is non-evaluative (no grades or tests), offers full age-mixing (ages 4-18), and many high school learners are dual-enrolled in college classes while maintaining internships and small businesses in the community."
"1002","Field Academy",NA,"Colorado",NA,"Field Academy is a remarkable high school where The community is our school.

The road is our classroom.

The nation is our textbook. 

The Field Academy offers community-based academic traveling expeditions around the United States. 

We are committed to rigorous academics, immersive interdisciplinary experiences, and the transformative power of exposure and connection to community.  

Our expeditions are designed for students to apply their learning to the world while gaining credits towards a diploma, studying for the GED, or transitioning into the workforce."
"1015","Summit Atlas","Seattle","Washington","Summit Public Schools","Summit Atlas is one of the Summit campuses leading the shift towards an updated vision that every student is prepared to suceed in a meaningful next step of their choosing, whether or not that involves college enrollment. In a field where the shift away from """"college for all"""" can too often mean lowered expectations for some, the school is finding a """"middle way"""" that honors students' own interests and aspirations while still focusing on high expectations and college access."
"1017","Montessori del Mundo","Aurora","Colorado","Colorado Charter School Institute","Montessori del Mundo (MdM) reimagines the purpose and structure of school by blending Montessori philosophy with dual-language immersion to create a deeply personalized, culturally affirming learning environment. Through individualized learning plans, extended instructional time, and low student-teacher ratios, MdM restructures the classroom to honor each child's developmental path. Its bilingual model empowers students to become self-directed, confident learners who navigate diverse linguistic and cultural contexts with ease. By centering autonomy, choice, and real-world exploration, MdM creates an engaging and empowering environment where students develop as multilingual, empathetic thinkers prepared for a global society."
"1018","Mountain Middle School","Durango","Colorado","Colorado Charter School Institute","Mountain Middle School (MMS) reimagines school by transforming learning into a hands-on, project-based experience grounded in inquiry, collaboration, and technology-rich exploration. Drawing inspiration from the High Tech High model, MMS restructures traditional instruction into interdisciplinary, real-world projects that engage students deeply and promote agency, creativity, and problem-solving. Its emphasis on technology integration and personalized support creates an environment where students build confidence as innovators and critical thinkers. MMS offers an empowering approach that prepares students not just to master content, but to apply their learning meaningfully within their community and the world."
"1057","Terra Nova","Buffalo","Minnesota",NA,"Terra Nova School, located in rural Minnesota, offers a unique, student-driven learning experience for grades 6–12 that blends real-world engagement, environmental awareness, and personalized support. Through a small, tight-knit community where each student has an advisor and belongs to a mixed-grade advisory group, Terra Nova emphasizes autonomy, curiosity, and innovation. Its project-based, experiential curriculum encourages students to design their own learning around passions and interests — often “out of the classroom, into the world” — while building lifelong skills like leadership, environmental stewardship, critical thinking, and problem-solving. With authentic assessments instead of a heavy focus on traditional tests, and opportunities for expeditions, hands-on projects, and community involvement, Terra Nova reimagines school as a launching pad for self-motivated, capable, and socially conscious young adults."
"1080","Kennedy Elementary School (Lindsay USD)","Lindsay","California","Lindsay Unified","LUSD designed and implements an Early Agency Model to nourish learners’ agency and the range of skills that underpin it. The model provides ample opportunities for learners to set meaningful goals, make plans to achieve
those goals, take action, and reflect on progress along the way within a supportive context. Additionally, it cultivates a wide range of skills that fuel lifelong learning, which include academic knowledge and skills, learning-to-learn skills, and positive mindsets."
"1103","Garrison Elementary School","Washington DC","District of Columbia","DCPS","Garrison Elementary School implements an innovative model, the Whole Child Model, which integrates multiple tiers of support throughout the school day to build a safe and supportive school climate as well as the intrapersonal and interpersonal skills young children need to regulate their emotions, manage stress, and handle conflicts productively."
"1104","Animas High School","Durango","Colorado","Colorado Charter School Institute","Animas High School reimagines traditional high school by centering strong relationships, student voice, and authentic project-based learning as the foundation for student success. Through advisory structures, interdisciplinary projects, community partnerships, and immersive experiences like Osprey Blocks, AHS creates learning environments that are engaging, connected to real-world issues, and responsive to student interests. Students develop a sense of purpose and ownership over their learning as they engage in critical thinking, collaboration, and self-advocacy. AHS empowers students by recognizing them as active contributors to their education, preparing them to lead with confidence and curiosity."
"1105","Kwiyagat Community Academy","Towaoc","Colorado","Colorado Charter School Institute","Kwiyagat Community Academy (KCA) reimagines the purpose of school by centering Indigenous knowledge, Nuchiu language, and cultural identity within every aspect of teaching and learning. KCA restructures learning around small class sizes, holistic development, and a curriculum that integrates traditional ecological knowledge, community values, and project-based learning. This approach creates an environment where students feel known, grounded, and empowered, and where school becomes a meaningful extension of cultural revitalization and community strength. By honoring students’ identities and expanding their academic and personal capacities, KCA creates a transformative, engaging learning experience."
"1106","AXIS International Academy","Fort Collins","Colorado","Colorado Charter School Institute","AXIS International Academy reimagines learning by integrating multilingual immersion, global competence, and whole-child development into a cohesive, student-centered model. Through its 50/50 immersion structure and language options in Spanish, French, and Mandarin, AXIS reframes the purpose of school as a place where students build cross-cultural understanding and cognitive flexibility. The school’s Whole Child Initiative and emphasis on social-emotional learning create an engaging, nurturing environment where students learn to manage emotions, collaborate effectively, and persevere through challenges. AXIS empowers students to become multilingual, globally minded citizens equipped for a rapidly changing world."
"1107","Colorado International Language Academy","Colorado Springs","Colorado","Colorado Charter School Institute","Colorado International Language Academy (CILA) reimagines the student experience by placing multilingualism, cultural immersion, and holistic development at the center of schooling. Through daily immersion in German, Mandarin, or Spanish with native-speaking teachers, CILA structures learning in ways that foster deep engagement, curiosity, and cultural awareness. The school’s focus on intellectual, physical, and character development ensures that students grow as confident, well-rounded individuals. By providing equitable access to rigorous language programs and culturally rich experiences, CILA empowers students to thrive academically and personally in an interconnected global environment."
"1122","International Academy at Francis Hammond Middle School","Alexandria","Virginia","Alexandria City Public Schools","The International Academy is a program of academic services within Francis C. Hammond Middle School offered to recently arrived immigrant students who are learning the English language. Students are on a team with teachers who are specially trained to teach students the core academic content and the English language simultaneously. In addition, students have a school counselor and administrator dedicated to meeting their specific needs. Students have access to all elective classes, physical education and health classes, and extracurricular activities and clubs that are offered at Francis C. Hammond Middle School.

Strong adult teaming at the International Academy supports multilingual learners through a coordinated system of instruction, student supports, and tiered interventions. Students engage in project-based learning while collaborating in groups with diverse levels of language proficiency and native languages; this approach accelerates students' learning of academic English while studying a rigorous curriculum. "
"1582","The Match High School and Career Center","Indianapolis","Indiana","Matchbook Learning","The Match is a newly launched high school from Matchbook Learning, building on the K-8 school's model of personalized learning model in the unique context of a turnaround school. The Match high school is taking personalized learning to the next level by integrating a career readiness. Students participate in career pathways supported by community partners in fields like welding, engineering, computer science, healthcare, media technology, entrepreneurship, and more. Not only are students gaining real-world career experience and getting plugged into the local economy, they are also getting world-class academics. Even in its inaugural year, the Match out-performed peer schools in state standardized assessments and PSAT. "
"1588","James E. Dottke Project-Based Learning High School","West Allis","Wisconsin","West Allis-West Milwaukee School District","Dottke PBL High School transformed from an alternative school where learners were sent because they didn't fit into the traditional school system to a school of choice for learners who want to learn differently. The Dottke community is an inspiration of what learning could and should be in high school. The Dottke team takes pride in that fact that their learning experiences are """"different by design"""" and are really student centered. This learning environment is a hidden gem in the Milwaukee area that everyone should be aware of and visit."
"1589","Sussex School","MISSOULA","Montana",NA,"Sussex emphasizes the whole learner in that in addition to academics they have strong programming in outdoor education and the arts. They have daily, weekly, yearly routines that foster strong community and culture. They are continuing to push their own boundaries and assumptions to grow and iterate on their established practices. "
"1592","Watershed School","Boulder","Colorado",NA,"Watershed starts the school year with an extended wilderness trip in advisory--where culture and connection are formed. Throughout the school year students are engaged deeply in interdisciplinary projects that often see them off campus working and learning in community. The school year ends with learning on key topics off campus in through extended domestic and international trips."
"1593","""""AECI 1 - The NYC Charter School for Architecture, Engineering, and Construction Industries""""","New York City (Bronx)","New York",NA,"Theme-related school faculty have worked in their fields and bring the expertise and real-world examples to the students. In addition to the rigorous curriculum and dual credit opportunities, the school has a course for all juniors called “College Readiness” and for seniors called “Post-secondary Readiness.” This speaks to the school’s dedication to the personal growth of their students as well as their academic growth."
"1594","Global Concepts Charter School","Lackawanna","New York",NA,"The school’s mission is to “use an innovative approach to challenge and support its students to have a positive impact on an ever-changing world.” The school offers STEAM instruction for technology education, K-12. Students experience opportunities for college credit, internships, and can explore certificate programs in culinary arts, digital media arts, nursing, business management, and entrepreneurship."
"1595","Health Sciences Charter School","Buffalo","New York",NA,"The school’s mission is “Health Sciences provide high school age youth with academic learning environments that prepare them to communicate effectively, think and reason critically, value diversity, engage in service learning, pursue academic excellence, and obtain sustainable and quality careers in the health sciences industry.” The school offers opportunities for students to experience dual enrollment and earn college credit; internships in health care and related fields; shadowing; volunteering at healthcare sites; medical guest speakers; community service and 21st century skills. Certificate programs include nursing assistant, physical fitness, Licensed Practical Nurse, phlebotomy, physical technician, and EKG technician."
"1596","Charter School For Applied Technologies","Buffalo","New York",NA,"This school’s motto is “Every day is career day.” Their mission is “to prepare students to attain family-sustaining careers by integrating career exploration and a lifelong learning culture.” Students experience opportunities for college credit, internships, certificate programs in health care, business, a hands-on greenhouse that functions as a learning lab and community service, and Early College and Career Pathways, including Project Lead the Way in manufacturing. "
"1597","The Portage School Of Leaders","South Bend","Indiana","South Bend Career and Success Academies","Andrew Hoyt is a visionary leader who has created a school that is a great example of the next horizon of education. Students are integrated into the community during the learning process and are measured against a wide range of competencies and durable skills."
